{
  "id": "sektion-us-2026-09",
  "market": "us",
  "units": "mm",
  "generated": "2026-09-14",
  "source": "Published SEKTION size guides (IKEA US category pages, dimensions.com, kitchen-installers.com), Sept 2026. Not product pages.",
  "items": [
    {
      "id": "frame:base:12x24x30",
      "kind": "frame",
      "type": "base",
      "brand": "IKEA",
      "series": "SEKTION",
      "name": "SEKTION base cabinet frame 12x24x30",
      "article": "102.653.92",
      "nominal": "12x24x30",
      "nominal_in": {
        "w": 12,
        "d": 24,
        "h": 30
      },
      "actual": {
        "w": 305,
        "d": 610,
        "h": 762
      },
      "verified": true,
      "source": "https://www.ikea.com/us/en/p/-10265392/",
      "verified_on": "2026-09-14"
    },
    {
      "id": "frame:base:15x24x30",
      "kind": "frame",
      "type": "base",
      "brand": "IKEA",
      "series": "SEKTION",
      "name": "SEKTION base cabinet frame 15x24x30",
      "article": "002.653.97",
      "nominal": "15x24x30",
      "nominal_in": {
        "w": 15,
        "d": 24,
        "h": 30
      },
      "actual": {
        "w": 381,
        "d": 610,
        "h": 762
      },
      "verified": true,
      "source": "https://www.ikea.com/us/en/p/-00265397/",
      "verified_on": "2026-09-14"
    },
    {
      "id": "frame:base:18x24x30",
      "kind": "frame",
      "type": "base",
      "brand": "IKEA",
      "series": "SEKTION",
      "name": "SEKTION base cabinet frame 18x24x30",
      "article": "202.653.96",
      "nominal": "18x24x30",
      "nominal_in": {
        "w": 18,
        "d": 24,
        "h": 30
      },
      "actual": {
        "w": 457,
        "d": 610,
        "h": 762
      },
      "verified": true,
      "source": "https://www.ikea.com/us/en/p/-20265396/",
      "verified_on": "2026-09-14"
    },
    {
      "id": "frame:base:21x24x30",
      "kind": "frame",
      "type": "base",
      "brand": "IKEA",
      "series": "SEKTION",
      "name": "SEKTION base cabinet frame 21x24x30",
      "article": "302.654.14",
      "nominal": "21x24x30",
      "nominal_in": {
        "w": 21,
        "d": 24,
        "h": 30
      },
      "actual": {
        "w": 533,
        "d": 610,
        "h": 762
      },
      "verified": true,
      "source": "https://www.ikea.com/us/en/p/-30265414/",
      "verified_on": "2026-09-14"
    },
    {
      "id": "frame:base:24x24x30",
      "kind": "frame",
      "type": "base",
      "brand": "IKEA",
      "series": "SEKTION",
      "name": "SEKTION base cabinet frame 24x24x30",
      "article": "902.653.88",
      "nominal": "24x24x30",
      "nominal_in": {
        "w": 24,
        "d": 24,
        "h": 30
      },
      "actual": {
        "w": 610,
        "d": 610,
        "h": 762
      },
      "verified": true,
      "source": "https://www.ikea.com/us/en/p/-90265388/",
      "verified_on": "2026-09-14"
    },
    {
      "id": "frame:base:30x24x30",
      "kind": "frame",
      "type": "base",
      "brand": "IKEA",
      "series": "SEKTION",
      "name": "SEKTION base cabinet frame 30x24x30",
      "article": "302.653.86",
      "nominal": "30x24x30",
      "nominal_in": {
        "w": 30,
        "d": 24,
        "h": 30
      },
      "actual": {
        "w": 762,
        "d": 610,
        "h": 762
      },
      "verified": true,
      "source": "https://www.ikea.com/us/en/p/-30265386/",
      "verified_on": "2026-09-14"
    },
    {
      "id": "frame:base:36x24x30",
      "kind": "frame",
      "type": "base",
      "brand": "IKEA",
      "series": "SEKTION",
      "name": "SEKTION base cabinet frame 36x24x30",
      "article": "802.653.98",
      "nominal": "36x24x30",
      "nominal_in": {
        "w": 36,
        "d": 24,
        "h": 30
      },
      "actual": {
        "w": 914,
        "d": 610,
        "h": 762
      },
      "verified": true,
      "source": "https://www.ikea.com/us/en/p/-80265398/",
      "verified_on": "2026-09-14"
    },
    {
      "id": "frame:base:15x15x30",
      "kind": "frame",
      "type": "base",
      "brand": "IKEA",
      "series": "SEKTION",
      "name": "SEKTION base cabinet frame 15x14 3/4x30",
      "article": "302.653.91",
      "nominal": "15x14 3/4x30",
      "nominal_in": {
        "w": 15,
        "d": 14.75,
        "h": 30
      },
      "actual": {
        "w": 381,
        "d": 375,
        "h": 762
      },
      "verified": true,
      "source": "https://www.ikea.com/us/en/p/-30265391/",
      "notes": "Shallow base; depth is 14 3/4\" nominal.",
      "verified_on": "2026-09-14"
    },
    {
      "id": "frame:sink_base:30x24x30",
      "kind": "frame",
      "type": "sink_base",
      "brand": "IKEA",
      "series": "SEKTION",
      "name": "SEKTION sink base cabinet frame 30x24x30",
      "article": "302.653.86",
      "nominal": "30x24x30",
      "nominal_in": {
        "w": 30,
        "d": 24,
        "h": 30
      },
      "actual": {
        "w": 762,
        "d": 610,
        "h": 762
      },
      "verified": true,
      "source": "https://www.ikea.com/us/en/p/-30265386/",
      "verified_on": "2026-09-14"
    },
    {
      "id": "frame:sink_base:36x24x30",
      "kind": "frame",
      "type": "sink_base",
      "brand": "IKEA",
      "series": "SEKTION",
      "name": "SEKTION sink base cabinet frame 36x24x30",
      "article": "802.653.98",
      "nominal": "36x24x30",
      "nominal_in": {
        "w": 36,
        "d": 24,
        "h": 30
      },
      "actual": {
        "w": 914,
        "d": 610,
        "h": 762
      },
      "verified": true,
      "source": "https://www.ikea.com/us/en/p/-80265398/",
      "verified_on": "2026-09-14"
    },
    {
      "id": "frame:wall:12x15x30",
      "kind": "frame",
      "type": "wall",
      "brand": "IKEA",
      "series": "SEKTION",
      "name": "SEKTION wall cabinet frame 12x14 3/4x30",
      "article": "102.654.72",
      "nominal": "12x14 3/4x30",
      "nominal_in": {
        "w": 12,
        "d": 14.75,
        "h": 30
      },
      "actual": {
        "w": 305,
        "d": 375,
        "h": 762
      },
      "verified": true,
      "source": "https://www.ikea.com/us/en/p/-10265472/",
      "verified_on": "2026-09-14"
    },
    {
      "id": "frame:wall:12x15x40",
      "kind": "frame",
      "type": "wall",
      "brand": "IKEA",
      "series": "SEKTION",
      "name": "SEKTION wall cabinet frame 12x14 3/4x40",
      "article": "902.654.73",
      "nominal": "12x14 3/4x40",
      "nominal_in": {
        "w": 12,
        "d": 14.75,
        "h": 40
      },
      "actual": {
        "w": 305,
        "d": 375,
        "h": 1016
      },
      "verified": true,
      "source": "https://www.ikea.com/us/en/p/-90265473/",
      "verified_on": "2026-09-14"
    },
    {
      "id": "frame:wall:15x15x15",
      "kind": "frame",
      "type": "wall",
      "brand": "IKEA",
      "series": "SEKTION",
      "name": "SEKTION wall cabinet frame 15x14 3/4x15",
      "article": "102.654.67",
      "nominal": "15x14 3/4x15",
      "nominal_in": {
        "w": 15,
        "d": 14.75,
        "h": 15
      },
      "actual": {
        "w": 381,
        "d": 375,
        "h": 381
      },
      "verified": true,
      "source": "https://www.ikea.com/us/en/p/-10265467/",
      "verified_on": "2026-09-14"
    },
    {
      "id": "frame:wall:15x15x20",
      "kind": "frame",
      "type": "wall",
      "brand": "IKEA",
      "series": "SEKTION",
      "name": "SEKTION wall cabinet frame 15x14 3/4x20",
      "article": "802.654.59",
      "nominal": "15x14 3/4x20",
      "nominal_in": {
        "w": 15,
        "d": 14.75,
        "h": 20
      },
      "actual": {
        "w": 381,
        "d": 375,
        "h": 508
      },
      "verified": true,
      "source": "https://www.ikea.com/us/en/p/-80265459/",
      "verified_on": "2026-09-14"
    },
    {
      "id": "frame:wall:15x15x30",
      "kind": "frame",
      "type": "wall",
      "brand": "IKEA",
      "series": "SEKTION",
      "name": "SEKTION wall cabinet frame 15x14 3/4x30",
      "article": "902.654.54",
      "nominal": "15x14 3/4x30",
      "nominal_in": {
        "w": 15,
        "d": 14.75,
        "h": 30
      },
      "actual": {
        "w": 381,
        "d": 375,
        "h": 762
      },
      "verified": true,
      "source": "https://www.ikea.com/us/en/p/-90265454/",
      "verified_on": "2026-09-14"
    },
    {
      "id": "frame:wall:15x15x40",
      "kind": "frame",
      "type": "wall",
      "brand": "IKEA",
      "series": "SEKTION",
      "name": "SEKTION wall cabinet frame 15x14 3/4x40",
      "article": "002.654.63",
      "nominal": "15x14 3/4x40",
      "nominal_in": {
        "w": 15,
        "d": 14.75,
        "h": 40
      },
      "actual": {
        "w": 381,
        "d": 375,
        "h": 1016
      },
      "verified": true,
      "source": "https://www.ikea.com/us/en/p/-00265463/",
      "verified_on": "2026-09-14"
    },
    {
      "id": "frame:wall:18x15x15",
      "kind": "frame",
      "type": "wall",
      "brand": "IKEA",
      "series": "SEKTION",
      "name": "SEKTION wall cabinet frame 18x14 3/4x15",
      "article": "602.654.55",
      "nominal": "18x14 3/4x15",
      "nominal_in": {
        "w": 18,
        "d": 14.75,
        "h": 15
      },
      "actual": {
        "w": 457,
        "d": 375,
        "h": 381
      },
      "verified": true,
      "source": "https://www.ikea.com/us/en/p/-60265455/",
      "verified_on": "2026-09-14"
    },
    {
      "id": "frame:wall:18x15x20",
      "kind": "frame",
      "type": "wall",
      "brand": "IKEA",
      "series": "SEKTION",
      "name": "SEKTION wall cabinet frame 18x14 3/4x20",
      "article": "502.654.65",
      "nominal": "18x14 3/4x20",
      "nominal_in": {
        "w": 18,
        "d": 14.75,
        "h": 20
      },
      "actual": {
        "w": 457,
        "d": 375,
        "h": 508
      },
      "verified": true,